pmid	lane_before_llm	gate_reason	model_p	final_decision	final_reason	topic_relevance	sem_intent	sem_seed	graph_ppr_pct	graph_links_frac	year_scaled	abstract_len_bin	pub_types	year	title	abstract
37481964	sent_to_llm		1.0000	include	off_topic	adjacent_meta_analysis	0.7455	0.7455	0.0	0.0000	0.8000	normal	Journal Article;Research Support, N.I.H., Extramural	2023	Evaluation of Analgesic Practice Changes Following the Nuss Procedure in Pediatric Patients.	Pectus excavatum repair by the Nuss procedure results in severe postoperative pain. Regional blocks and intercostal nerve cryoablation (INC) have emerged as potential strategies to manage analgesia. This study compares pain-related outcomes following these perioperative interventions. We reviewed charts of patients <18 y who underwent the Nuss procedure at Duke Children's Hospital from July 2018 to June 2022. Patients were divided into three groups by analgesic strategy: no block, regional catheters, or INC, representing the chronologic change in our practice. The primary outcome was total and daily in-hospital opioid utilization measured by oral morphine equivalents (OMEs). Secondary outcomes included average daily pain scores, length of stay, opioid refills after discharge, and complications. Twenty-one patients were included and analyzed: no block (n = 6), regional catheters (n = 7), and INC (n = 8). INC-treated patients required significantly lower total postoperative, in-hospital OMEs (64 ± 47 [mean ± standard deviation]) than those with no block (270 ± 217, P = 0.04) or those with regional catheters (273 ± 176, P = 0.03). INC was associated with longer average operative times (161 ± 36 min) than no block (105 ± 21 min, P = 0.005) or regional catheters (90 ± 11 min, P < 0.001). INC-treated patients had shorter hospital length of stays (median 68 h) than those with regional catheters (median 74 h, P = 0.006). INC was associated with longer operative times but decreased in-hospital OMEs when compared to bilateral regional block catheters and multimodal analgesia alone.
37462727	sent_to_llm		1.0000	include	off_topic	adjacent_meta_analysis	0.8068	0.8068	0.0	0.0000	0.8000	normal	Journal Article;Scoping Review	2023	Intercostal Nerve Cryoablation for Postoperative Pain Control in Pediatric Thoracic Surgery: A Scoping Review.	Background: Cryoanalgesia uses the application of cold temperatures to temporarily disrupt peripheral sensory nerve function for pain control. This review outlines the principles of cryoablation, clinical applications, and clinical data for its use in pediatric thoracic surgery. Methods: A comprehensive PubMed search was performed using the principal terms and combinations of cryoablation, cryoanalgesia, Nuss, Nuss repair, pectus, pectus excavatum, thoracic surgery, thoracotomy, and chest wall. Pediatric articles were reviewed and included if relevant. Adult articles were reviewed for supporting information as needed. Reference lists of included articles were reviewed for possible additional sources. Discussion: The scientific and clinical principles of cryoablation are outlined, followed by a focused review of current clinical application and outcome data. Conclusion: Postoperative pain is a major challenge following thoracic surgery. Cryoanalgesia is emerging as an adjunct in pediatric thoracic surgery, particularly for the Nuss procedure or minimally invasive repair of pectus excavatum. It effectively controls pain, decreasing postoperative opioid use and hospital length of stay with few short-term complications. Although more long-term studies are needed, early evidence suggests there is reliable return of sensation to the chest wall and long-term neuropathic pain is rare.
37407278	sent_to_llm		1.0000	include	off_topic	primary_rct	0.8031	0.8031	0.0	0.0000	0.9000	normal	Journal Article	2024	Combined erector spinae plane block with surgical intercostal nerve cryoablation for Nuss procedure is associated with decreased opioid use and length of stay.	Pain management for patients undergoing the Nuss procedure for treatment of pectus excavatum can be challenging. In an effort to improve pain management, our institution added bilateral single injection erector spinae plane (ESP) blocks to surgeon placed intercostal nerve cryoablation. We aimed to assess the efficacy of this practice change. Retrospective clinical data from a single academic medical center were evaluated. Due to an institutional change in clinical management, we were able to perform a before and after study. Twenty patients undergoing Nuss procedure who received bilateral ultrasound-guided single-shot T6 level ESP blocks and intercostal nerve cryoablation were compared with a historical control cohort of 20 patients who underwent Nuss procedure with intercostal nerve cryoablation alone. The primary outcome variables included postoperative pain scores, total hospital opioid use, and hospital length of stay. Median total hospital intravenous morphine milligram equivalents was lower for the ESP group than for the control group (0.60 (IQR 0.35-0.88) vs 1.15 mg/kg (IQR 0.74-1.68), p<0.01). There was no difference in postoperative pain scores between the two groups. Mean hospital length of stay was 2.45 (SD 0.69) days for the control group and 1.95 (SD 0.69) days for the ESP group (p=0.03). No adverse events related to block placement were identified. In a single-center academic practice, the addition of bilateral single injection ESP blocks at T6 to surgeon performed cryoablation reduced opioid consumption without a change in subjectively reported pain scores. The results from this pilot study can provide effect size estimates to guide the design of future randomized trials.
37279827	sent_to_llm		1.0000	include	off_topic	adjacent_meta_analysis	0.6885	0.6885	0.0	0.0000	0.8000	normal	Journal Article	2023	Evolution of Pain Control for Adult Pectus Excavatum Repair.	Pain control after minimally invasive repair of pectus excavatum (MIRPE) can be challenging, especially in adult patients undergoing surgical repair. This study reviewed different analgesic modalities used over ≥10 years after pectus repair. A retrospective analysis was performed of adult patients (≥18 years) who underwent uncomplicated primary MIRPE at a single institution from October 2010 to December 2021. Patients were classified by analgesic modality used: epidural, elastomeric continuous infusion subcutaneous catheters (SC-Caths), and intercostal nerve cryoablation. Comparisons among the 3 groups were performed. In total, 729 patients were included (mean age, 30.9 ±10.3 years; 67% male; mean Haller index, 4.9 ±3.0). Patients in the cryoablation group required significantly lower doses of morphine equivalents (P < .001) and had overall the shortest hospital stay (mean, 1.9 ±1.5 days; P < .001) with <17% staying >2 days (vs epidural at 94% and SC-Cath at 48%; P < .001). The cryoablation group had a lower incidence of ileus and constipation (P < .001) but a higher incidence of pleural effusion requiring thoracentesis (P = .024). Mean pain scores among groups were minor (<3), and differences were insignificant. The use of cryoablation in conjunction with enhanced recovery pathways provided significant benefit to our patients undergoing MIRPE compared with previous analgesic modalities. These benefits included a decrease in length of hospital stay, a reduction of in-hospital opioid use, and a lower incidence of opioid-related complications associated with constipation and ileus. Further studies to assess additional potential benefits with long-term follow-up after discharge are warranted.
36894442	sent_to_llm		1.0000	include	off_topic	primary_rct	0.8031	0.8031	0.0	0.0000	0.8000	normal	Journal Article	2023	Implementation of a Cryoablation-based Pain Management Protocol for Pectus Excavatum.	The Nuss repair for pectus excavatum is associated with significant postoperative pain. Our institution developed protocols to standardize pain management for pectus excavatum patients in the immediate postoperative period. We present our experience with protocol implementation and patient outcomes. We standardized regional anesthesia with a 0.25% bupivacaine incisional soaker catheter (post-implementation 1, PI1) before transitioning to intercostal nerve cryoablation (INC) (post-implementation 2, PI2). Patient outcomes were tracked using statistical process control charts in AdaptX™ OR Advisor and run charts in Tableau. Chi-squared tests assessed demographic differences between cohorts. 244 patients were included: 78 pre-implementation, 108 PI1, and 58 PI2. Average age was 15.9-16.5 years. Patients were majority male, non-Hispanic white, and English speaking. Hospital length of stay decreased 4.1-2.4 days. INC increased surgery time (99-125 min) but decreased PACU time (112-78 min). Maximum pain scores improved in PACU (7.7-6.0) and 0-24 h postoperatively (8.3-6.8) but were not different 24-48 h postoperatively (5.4-5.8). Average opioid dosing decreased 0-48 h from 1.9 to 0.8 mg/kg morphine milliequivalents and was associated with reduction in post-operative nausea and constipation. There were no 30-day readmissions. An institution-wide pain management protocol using INC for pectus excavatum patients was implemented. Intercostal nerve cryoablation was found to be superior to bupivacaine incisional soaker catheters and reduced hospital length of stay, immediate postoperative pain scores, morphine milliequivalent opioid dosing, postoperative nausea, and constipation. Level IV.
36788057	sent_to_llm		1.0000	borderline	off_topic	adjacent_review	0.6182	0.6182	0.0	0.0000	0.8000	normal	Journal Article	2023	Development of a five point enhanced recovery protocol for pectus excavatum surgery.	We implemented and evaluated an Enhanced Recovery after Surgery (ERAS) protocol for Nuss procedures consisting of patient education, bowel management, pre/post-operative transitional pain service involvement, serratus anterior plane blocks and intercostal nerve cryoablation. A 5-point ERAS protocol was implemented using multiple plan-do-study-act (PDSA) cycles. Data was collected prospectively for patients in the full ERAS protocol and retrospectively for previous patients. The primary outcome was length of stay (LOS). Secondary outcomes were opioid consumption, pain scores, protocol compliance and patient satisfaction. The impact of PDSA cycles and the ERAS protocol was quantified using statistical process control charts and Mann Whitney U test. A total of 53 patients were identified, 13 within the ERAS protocol and 40 prior to introduction. There was no difference in age, sex, or Haller index between the two cohorts. The median LOS was decreased by 3 days in the ERAS cohort (P = 0.00001). There was decreased opioid consumption on post-operative day 1 (1.47 vs 1.96 MME/kg, p = 0.009) and overall (3.12 vs 6.35 MME/kg, p = 0.0042) in the ERAS cohort. Median pain scores did not differ between cohorts. ERAS bundle element compliance was: education 92%, bowel management 100%, transitional pain involvement 100%, serratus block 100% and cryoablation 100%. The 1-month survey revealed that 92% of patients were satisfied with their experience. Our results demonstrate significant reduction in LOS and a trend to decreasing opioid consumption in hospital following ERAS protocol implementation and support the further application of ERAS protocols in pediatrics. III - Retrospective comparative study.
36737261	sent_to_llm		1.0000	borderline	insufficient_info	primary_rct	0.7156	0.7156	0.0	0.0000	0.8000	normal	Journal Article	2023	Initial Outcomes Using Cryoablation in Surgical Management of Slipping Rib Syndrome.	Minimally invasive repair of pectus excavatum (MIRPE) and cartilaginous rib excision (CRE) for slipping rib syndrome (SRS) are painful procedures. Intercostal nerve cryoablation (Cryo) controls pain and decreases opioid use in MIRPE. Herein, we describe our experience with cryoablation in CRE. A retrospective chart review was performed of all patients undergoing CRE between 2018 and 2022. Data on demographics, clinical characteristics, operative details, and hospital course were collected. A total of 98 patients underwent CRE: 68 CRE without cryo, 22 CRE + Cryo, and 8 combined MIRPE + CRE + Cryo. Ninety percent of patients underwent bioabsorbable rib plating. Patients were predominantly female (79%, 73%, 50% respectively) with median ages 17.6, 16.9, and 14.2 years respectively. CRE + Cryo patients used significantly less opioids in hospital (0.6 OME/kg [0.1,1.2]) compared to CRE without cryo (1.0 OME/kg [0.6,2.1]), p < 0.05. The median length of stay (LOS) in CRE + Cryo was 1 day [1,2] compared to 2 days in CRE without cryo [1,2], p = 0.09. MIRPE + CRE + Cryo patients used 0.6 OME/kg [0.2,8.0] with a 2 day [1,5.5] LOS. Ninety-one percent of Cryo patients had cryoablation of T9 and/or T10 intercostal nerves, with no documented abdominal wall laxity at median follow-up of 16 days. Cryo was applied extra-thoracically in CRE + cryo without thoracoscopy or lung isolation, while MIRPE + CRE + Cryo used a combination extra-/intra-thoracic cryoablation in with thoracoscopy. Intercostal nerve cryoablation reduces opioid use and LOS in patients undergoing cartilaginous rib excision for slipping rib syndrome. Cryotherapy to as low as T10 did not result in abdominal wall laxity and can be applied extra-thoracically without the need for thoracoscopy. Ongoing prospective studies are required to assess the long-term outcomes. III.
36646539	sent_to_llm		1.0000	include	off_topic	primary_rct	0.8713	0.8713	0.0	0.0000	0.7000	normal	Journal Article	2022	Cost and outcomes of intercostal nerve cryoablation versus thoracic epidural following the Nuss procedure.	Pectus excavatum is the most common congenital chest wall abnormality, with the Nuss procedure being the most commonly performed repair. Pain control is the predominant factor in the postoperative treatment of these patients. This study aims to compare the cost and outcomes of intercostal nerve cryoablation (INC) and thoracic epidural (TE) in patients undergoing the Nuss procedure. A retrospective chart review was conducted at our institution for all patients who underwent the Nuss procedure for pectus excavatum from 2002 to 2020. Patients were stratified by pain management strategy, INC vs. TE. Chi-square and Fisher's exact were used to compare categorical variables. Wilcoxon tests were used to evaluate continuous variables and costs. A total of 158 patients were identified. Of these, 80.4% (N = 127) were treated with epidural, while 19.6% (N = 31) were treated with intercostal nerve cryoablation. The INC group had lower rates of PCA use (35.5% vs. 93.7%, p < 0.001), lower total morphine milligram equivalent requirement (27.0 vs. 290.8, p < 0.001), and shorter length of stay (3.2 days vs. 5.3 days, p < 0.001) compared to the TE group. INC was also associated with longer operative times (153.0 min vs. 89.0 min, p < 0.001). The total hospitalization cost for the INC group was higher compared to the TE group ($24,742.5 vs $21,621.9, p = 0.001). In patients undergoing the Nuss procedure, compared to thoracic epidural, INC was associated with lower opioid use and shorter length of stay but at the cost of longer operative time and increased hospitalization cost. Treatment Study, Level III.
36427448	sent_to_llm		1.0000	include	off_topic	primary_rct	0.7177	0.7177	0.0	0.0000	0.7000	normal	Journal Article	2022	Intercostal Nerve Cryoablation is Associated with Reduced Opioid Use in Pediatric Oncology Patients.	Intercostal nerve cryoablation reduces postoperative pain in adults undergoing thoracotomy and children undergoing pectus excavatum repair. We hypothesize that cryoablation is associated with decreased post-thoracotomy pain and opioid use in pediatric oncology patients. A single-center retrospective cohort study was performed for oncology patients who underwent thoracotomy from January 1, 2017 to May 31, 2021. Outcomes included postoperative opioid use measured in morphine milligram equivalents per kilogram (MME/kg), pain scores (scale 0-10), and opioid prescription at discharge. Univariable analysis compared patients who received cryoablation to patients who did not receive cryoablation. Multivariable regression analysis controlling for age and prior thoracotomy evaluated associations between cryoablation and postoperative pain. Overall, 32 patients (19 males:13 females) underwent thoracotomy with 16 who underwent >1 thoracotomy resulting in 53 thoracotomies included for analysis. Cryoablation was used in 14 of 53 (26.4%) thoracotomies. Throughout the postoperative hospitalization, patients receiving cryoablation during thoracotomy consumed less opioids compared to patients who did not receive cryoablation (median 0.38 MME/kg, interquartile range [IQR] 0.20-1.15 versus median 1.47 MME/kg, IQR 0.71-4.02, P < 0.01). Maximum pain scores were lower in cryoablation patients (median 6, IQR 5-8) than noncryoablation patients (median 8, IQR 6-10), with a significant difference observed on postoperative day 4 (P = 0.01). Cryoablation patients were also less frequently prescribed opioids at discharge (21.4% versus 58.97%, P = 0.02). Multivariable regression demonstrated that cryoablation was associated with 2.59 MME/kg less opioid use (95% confidence interval -4.56 to -0.63) and decreased likelihood of opioid prescription at discharge (adjusted odds ratio 0.14, 95% confidence interval 0.03-0.67). Cryoablation is significantly associated with decreased post-thoracotomy pain and opioid use in pediatric cancer patients and should be considered in postoperative pain regimens.
36350702	sent_to_llm		1.0000	include	off_topic	primary_rct	0.7591	0.7591	0.0	0.0000	0.7000	normal	Journal Article	2022	Intercostal Nerve Cryoablation in Minimally Invasive Repair of Pectus Excavatum: Effect on Pulmonary Function.	Introduction: Cryoablation of intercostal nerves is performed for pain control after minimally invasive repair of pectus excavatum (MIRPE). Cryoablation affects both sensory and motor neurons, resulting in temporary anesthesia to the chest wall and loss of intercostal motor function. The study objective is to determine the effect of cryoablation on incentive spirometry (IS) volumes, as a measure of pulmonary function, after MIRPE. Materials and Methods: A single-institution retrospective review of pediatric patients undergoing MIRPE was performed. All patients received a multimodal regimen (MMR) of analgesics postoperatively. Three groups were compared-cryoablation (CRYO), elastomeric pain pump (EPP), and MMR alone. The primary outcomes were postoperative IS volumes and IS volumes as a ratio of preoperative forced vital capacity (FVC). Secondary outcomes included pain scores, opioid use, length of stay (LOS), and infectious complications. Results: MIRPE was performed in 115 patients: 50 CRYO, 50 EPP, and 15 MMR alone. Groups were similar for demographics and pectus excavatum severity. Postoperative spirometry measurements were similar across groups: IS (CRYO 750 mL [500,961] versus EPP 750 mL [590,1019] versus MMR 696 mL [500,1037], P = .77); IS/FVC (CRYO 0.19 [0.14,0.26] versus EPP 0.20 [0.16,0.26] versus MMR 0.16 [0.15,0.24], P = .69). Although pain scores were also similar across groups, CRYO patients used less opioid (P < .05) and had shorter LOS (P < .05). Postoperative pneumonia was rare and similar across groups (P = 1.00). Conclusion: Intercostal nerve cryoablation during MIRPE does not adversely affect postoperative IS volumes or increase pneumonia rate, despite the temporary loss of motor innervation to intercostal muscles. Cryoablation provides effective pain control with less opioid use.
36283847	sent_to_llm		1.0000	include	off_topic	primary_rct	0.7719	0.7719	0.0	0.0000	0.7000	normal	Journal Article	2022	Effectiveness of one minute per level intercostal nerve cryoablation for postoperative analgesia after surgical correction of pectus excavatum.	Intraoperative intercostal nerve cryoablation has emerged as a promising modality for postoperative analgesia following Surgical Correction of Pectus Excavatum (SCOPE). Most centers use two-minute cryoablation per level, although data from histologic and adult studies suggest the effectiveness of one-minute freezes. We aimed to describe our center's experience with one minute per level cryoablation. A retrospective single institution review of patients undergoing SCOPE was performed to compare patients pre- and post-intercostal nerve cryoablation implementation. Cryoablation was performed as one minute for each of the thoracic intercostal nerves T3-T7. Multivariable regression analyses were conducted to compare the outcomes and cost between pre- and post-implementation groups. During the study period, 198 patients underwent SCOPE with one Nuss bar, receiving either intraoperative intercostal nerve cryoablation (Cryo, n = 100) or preoperative thoracic paravertebral catheters (NoCryo, n = 98). Surgical time was on average 9 min longer for the Cryo group (p<0.01). Median length of stay for the Cryo group was 3 days shorter compared to the NoCryo group (p<0.01). The Cryo group had a 19-fold and 5.6-fold reduction in average inpatient and total postoperative opioid usage, respectively (p<0.01). Total hospital costs were significantly lower in the Cryo group (p<0.01). Overall complication rate was not statistically significant different between the two groups. Intraoperative one minute per level cryoablation is a potent approach to postoperative analgesia for SCOPE patients that led to a shorter hospital length of stay, lower hospital costs, and decreased opioid use compared to conventional analgesia at our institution. Pediatric surgeons performing correction of chest wall deformities should consider offering this technique.
35489402	sent_to_llm		1.0000	include	off_topic	primary_rct	0.7781	0.7781	0.0	0.0000	0.7000	normal	Journal Article	2022	Association of Intercostal Nerve Cryoablation During Nuss Procedure With Complications and Costs.	Intercostal nerve cryoablation with the Nuss procedure has been shown to decrease opioid requirements and hospital length of stay; however, few studies have evaluated the impact on complications and hospital costs. A retrospective cohort study was performed for all Nuss procedures at our institution from 2016 through 2020. Outcomes were compared across 4 pain modalities: cryoablation with standardized pain regimen (n = 98), patient-controlled analgesia (PCA; n = 96), epidural (n = 36), and PCA with peripheral nerve block (PNB; n = 35). Outcomes collected included length of stay, opioid use, variable direct costs, and postoperative complications. Univariate and multivariate hierarchical regression analysis was used to compare outcomes between the pain modalities. Cryoablation was associated with increased total hospital cost compared with PCA (cryoablation, $11 145; PCA, $8975; P < .01), but not when compared with epidural ($9678) or PCA with PNB ($10 303). The primary driver for increased costs was operating room supplies (PCA, $2741; epidural, $2767; PCA with PNB, $3157; and cryoablation, $5938; P < .01). With multivariate analysis, cryoablation was associated with decreased length of stay (-1.94; 95% CI, -2.30 to -1.57), opioid use during hospitalization (-3.54; 95% CI, -4.81 to -2.28), and urinary retention (0.13; 95% CI, 0.05-0.35). Cryoablation significantly reduces opioid requirements and length of stay relative to alternative modalities, but it was associated with an increase in total hospital costs relative to PCA, but not epidural or PCA with PNB. Cryoablation was not associated with allodynia or slipped bars requiring reoperation.
35379492	sent_to_llm		1.0000	include	off_topic	primary_rct	0.7284	0.7284	0.0	0.0000	0.7000	normal	Journal Article	2022	Cryoablation is associated with shorter length-of-stay and reduced opioid use after the Ravitch procedure.	The use of intercostal nerve cryoablation (INC) is becoming increasingly common in patients undergoing pectus repair. This study sought to evaluate the use of INC compared to traditional use of thoracic epidural (TE) in patients undergoing the modified Ravitch procedure. A retrospective review of 37 patients undergoing the modified Ravitch repair with either INC or TE from March 2009 to July 2021 was conducted. The operations were performed by four surgeons who worked together at four different hospitals and have the same standardized practice. The primary outcome measure was hospital length of stay (LOS). Secondary variables included surgical time, total operating room time, operating room time cost, total hospital cost, inpatient opioid use, long term opioid use after discharge, and post-operative complications. LOS decreased to 2.8 days in the INC group compared to 6 days in the TE group (p<0.0001). Surgical time and total OR time was increased in the INC group. The INC group experienced significantly lower hospital costs (p<0.01). Total hospital opioid administration was significantly lower in INC group, and there was a significant decrease in long term opioid use in the INC group (p<0.0001). INC is a newer modality that decreases LOS, controls pain, and results in overall cost savings for patients undergoing the modified Ravitch procedure. We recommend that INC be included in the current practice for postoperative pain control in pectus disorder patients undergoing the modified Ravitch procedure.
