pmid	lane_before_llm	gate_reason	model_p	final_decision	final_reason	topic_relevance	sem_intent	sem_seed	graph_ppr_pct	graph_links_frac	year_scaled	abstract_len_bin	pub_types	year	title	abstract
35290267	sent_to_llm		1.0000	include	off_topic	primary_rct	0.7363	0.7363	0.0	0.0000	0.7000	normal	Journal Article	2022	Impact of Cryoablation on Pectus Excavatum Repair in Pediatric Patients.	Minimally invasive repair of pectus excavatum (MIRPE) involves placement of a transthoracic, retrosternal support bar under thoracoscopic guidance. Despite its minimally invasive technical approach, postoperative pain is a significant morbidity that often results in increased length of stay. Multi-modal pain control strategies have been used in the past with limited success. Recently, the use of intraoperative intercostal nerve cryoablation (CA) has been added. In the present study, we aim to evaluate the effects of CA on postoperative pain control, opioid requirements, and perioperative outcomes. A single-center, retrospective chart review of all patients (less than 18 years old) who underwent MIRPE from 2009 to 2020 was performed. CA was started in June 2018. Data collection included demographics, preoperative characteristics, intraoperative findings, and postoperative outcomes. We hypothesized that CA would be associated with improved pain scores, lower doses of total inpatient opioid requirement, and shorter length of stay (LOS). One hundred sixty-one patients met inclusion criteria: 75 underwent intraoperative CA and 86 underwent MIRPE without CA (NCA group). CA significantly decreased median LOS from 4 days in NCA to 2 days; the use of CA was the only significant predictor of LOS on linear regression. CA was also associated with decreased total PCA, intravenous opioid, and oral opioid dosages. There was no difference in inpatient pain scores and a slight increase in mean procedure time. However, CA was associated with significantly decreased postoperative complications. The use of cryoablation during MIRPE significantly decreases LOS, perioperative opioid requirements, and postoperative complications, with a minimal increase in operative time. Cryoablation is an effective pain control modality in the surgical management of chest wall deformities in children.
35277249	sent_to_llm		1.0000	include	off_topic	primary_rct	0.7239	0.7239	0.0	0.0000	0.7000	normal	Journal Article;Observational Study	2022	Short and long term outcomes of using cryoablation for postoperative pain control in patients after pectus excavatum repair.	We report the findings of a three-year prospective observational study elucidating long-term symptoms and complications of patients who underwent minimally invasive pectus excavatum repair with intercostal nerve cryoablation with specific attention to postoperative pain control associated with the cryoablation technique. Surveys were administered to patients who underwent bar placement for pectus excavatum with intercostal nerve cryoablation from 2017 to 2021 regarding pain scores, pain medication usage, and limitations to activity beginning on the day of surgery, on the day of discharge, and at two-week and three-month follow-up. Of 110 patients, forty-eight (44%) completed the discharge survey; sharp pain and pressure on the first postoperative night were the most described pain characteristics, most frequently in the middle of the chest. On follow-up, 55% of patients reported tolerable residual pain at two weeks and 41% at three months, with 25% requiring intermittent pain medication at three months. There were three readmissions for inadequate pain control and 110 calls to the surgery clinic by three-month follow-up, most commonly for persistent pain and frequent popping sensation with movement. Although cryoablation is an excellent pain control modality, these data suggest that patients underreport functional symptoms and experience more frequent discomfort and alteration of daily living activities.
35232599	sent_to_llm		1.0000	borderline	insufficient_info	primary_rct	0.7637	0.7637	0.0	0.0000	0.7000	normal	Journal Article	2022	Infectious complications of intercostal nerve cryoablation mediated by perioperative hypothermia during pediatric Nuss procedure.	Intercostal nerve cryoablation (cryoanalgesia) is increasingly used for pain control in minimally invasive repair of pectus excavatum (MIRPE) by Nuss procedure. Cryoanalgesia may lower core body temperature and increase the risk of postoperative infectious complications. We investigated cryoanalgesia effects on infectious complications following MIRPE. We performed a retrospective review of patients undergoing MIRPE at our institution. Patients treated via multimodal analgesia with cryoanalgesia (Cryo) were compared to patients treated via multimodal analgesia +/- elastomeric pain pumps (Non-cryo). Core body and intraoperative minimum/maximum temperatures were recorded. Primary outcomes were wound infection and pneumonia; secondary outcome was length of stay (LOS). Fisher's Exact and Mann-Whitney U tests compared proportions and medians respectively, p-value ≤ 0.05 being significant. 80 patients were included, 35(43.7%) Cryo and 45(56.3%) Non-cryo. There were no significant differences in median [IQR] for age(15[13.3,16.0];p =0.86), number of bars inserted (2[1,2];p = 0.57), or operative time(123.5[98.3, 148.8]; p = 0.11) between the two groups. We found no significant differences in median [IQR] minimum temperature (35.4°C [35.0,35.8];p = 0.76), median change in intraoperative temperature (-0.13°C [-0.44,0.00];p = 0.94) or median recovery temperature (-1.10°C [-1.56,-0.65]; p = 0.59) between Cryo and Non-cryo. PACU temperature was significantly lower in the Cryo group, 36.4°C [36.2,36.6] p = 0.04. There were no postoperative wound infections in either group and no significant difference in incidence of postoperative pneumonia (8.57% versus 2.22%,p =  0.31) or median[IQR] for LOS (4[3,4];p = 0.57), between Cryo and Non-cryo patients. Although cryoanalgesia for MIRPE resulted in lower core body temperature, there appears to be no significant difference between Cryo and Non-Cryo patients for LOS or infectious complications.
34823843	sent_to_llm		1.0000	include	off_topic	primary_rct	0.7564	0.7564	0.0	0.0000	0.6000	normal	Journal Article	2021	Next day discharge after the Nuss procedure using intercostal nerve cryoablation, intercostal nerve blocks, and a perioperative ERAS pain protocol.	The Nuss procedure for pectus excavatum has historically been associated with significant postoperative pain, which has been the major factor contributing to hospital length of stay (LOS). A single-institution, prospective study of 40 consecutive patients undergoing Nuss bar placement for pectus excavatum between November 2019 and January 2021 was conducted to assess the effectiveness of a multimodality pain management protocol. All patients received T3-T8 intercostal nerve cryoablation (INC), T3-T8 bupivacaine intercostal nerve blocks, Exparel at the skin incisions, and management with a perioperative analgesia regimen that minimized narcotic usage. The primary outcome was LOS. Secondary outcomes included opioid use, pain scores, and time to sensory recovery. 37/40 patients (92.5%) were discharged home on postoperative day (POD) 1, and 3/40 (7.5%) were discharged on POD 2 (mean LOS = 1.1 days). The median average postoperative pain score was 2/10. After eliminating IVPCA from our protocol, total oral morphine equivalent (OME) decreased by 73% (55.5 mg to 15 mg) with no change in pain scores or discharge timing. INC combined with bupivacaine intercostal nerve blocks and a pre- and post-hospital analgesia protocol facilitated discharge one day after the Nuss procedure, achieved excellent pain control, and eliminated the need for intravenous opioids.
34670678	sent_to_llm		1.0000	include	off_topic	adjacent_meta_analysis	0.7318	0.7318	0.0	0.0000	0.6000	normal	Journal Article	2021	Same-day discharge following the Nuss repair: A comparison.	Intercostal Nerve Cryoablation (INC) has significantly improved pain control following the Nuss repair of pectus excavatum (PE). This study sought to evaluate patients undergoing the Nuss repair with INC compared to the Nuss repair with an ERAS protocol, INC, and intercostal nerve blocks (INB). In June 2020, a new protocol was implemented involving surgery, anesthesia, nursing, physical therapy, and child life with the goal of safe same day discharge for patients undergoing the Nuss repair. They were compared to a control group who underwent the Nuss repair with INC alone in 2017-2019. The primary outcome measure was hospital length of stay (LOS) in hours, secondary outcomes were number of patients discharged on postoperative day (POD) 0, and returns to the emergency department (ED), urgent care (UC), and operating room (OR). The characteristics between the groups were the same (Table 1). The mean LOS was 11.8 h in the INB group versus 58.2 h in the INC group, p < 0.01. 10 of 15 patients in the INB group went home on POD 0 (average of 5.5 h postop), versus 0 patients in the INC only group, p < 0.01. Five patients in the INB stayed overnight. Two patients stayed owing to anxiety, one owing to urinary retention, one owing to nausea, and one owing to drowsiness. None stayed for pain control. Four patients in the INC group returned to the ED for pain control, versus 0 in the INB group, and 1 patient in the INB returned to UC for constipation. The majority of patients undergoing the Nuss repair of PE with a multidisciplinary regimen of pre and postoperative nursing education, precise intraoperative anesthesia care, performance of direct vision INB and INC, as well as careful surgery can go home on the day of surgery without adverse outcomes or unanticipated returns to the hospital. Level II.
34560787	sent_to_llm		1.0000	borderline	off_topic	adjacent_review	0.7046	0.7046	0.0	0.0000	0.6000	normal	Journal Article	2021	Variations in Nuss Procedure Operative Techniques and Complications: A Retrospective Review.	The Nuss procedure is the most common and preferred operative correction of pectus excavatum. Surgeon preference and patient factors can result in variations in Nuss procedure technique. We hypothesize that certain techniques are associated with increased risk of complications. We performed a single-center retrospective review of Nuss operations from 2016 to 2020. Variations in intraoperative techniques included sternal elevator (SE) use, number of bars placed, and usage of bilateral stabilizing sutures. Patient demographics, intraoperative data, and postoperative outcomes were reported as median with interquartile ranges or percentages. Statistical significance (p < 0.05) was determined with Wilcoxon's rank-sum and chi-square tests. Multivariate analysis was performed to control for introduction of intercostal nerve cryoablation and surgeon volume, and reported as odds ratio with 95% confidence interval. Two hundred and sixty-five patients were identified. Patients repaired with two bars were older with a larger Haller index (HI). Patient demographics were not significantly different for SE or stabilizing suture use. Placement of two bars was associated with significantly increased risk of readmission. Similarly, SE use was associated with increased risk of pleural effusion and readmission. Finally, the use of bilateral stabilizing sutures resulted in less frequent slipped bars without statistical significance. Older patients with a larger HI were more likely to need two bars placed to repair pectus excavatum. Placement of multiple bars and SE use are associated with significantly higher odds of certain complications.
33977693	auto_exclude	language	1.0000	exclude	language	off_topic	0.8383	0.8383	0.0	0.0000	0.6000	normal	Journal Article	2021	[Intercostal nerve cryoablation in correction of pectus excavatum in adults].	To evaluate an effectiveness of cryoanalgesia in older patients with pectus excavatum and to determine feasibility of further research. We have developed an original technique of intercostal nerve cryoablation for correction of pectus excavatum in adults. The results of intercostal nerve cryoablation during correction of pectus excavatum in 10 older patients were analyzed. Postoperative outcomes were followed-up over a period of 4 - 12 months. There were no perioperative surgical complications. In 1 case, moderate pain syndrome persisted for 3 months after surgery (mean VAS score 2±1.3). In 9 months, mean VAS score was 0.6±0.6 in a month after surgery. Intercostal nerve cryoablation in correction of pectus excavatum in adults may be an alternative to the current methods of regional analgesia. Further research is requried to achieve objective information.
33678403	sent_to_llm		1.0000	include	off_topic	primary_rct	0.7401	0.7401	0.0	0.0000	0.6000	normal	Journal Article	2021	Same day discharge for pectus excavatum-is it possible?	The use of intercostal nerve cryoablation (INC) has been an effective modality for treating pain in patients undergoing pectus excavatum (PE) repair. This study sought to evaluate if PE patients undergoing Nuss procedures with INC and intercostal nerve block (INB) could safely be discharged the same day of surgery. A prospective study with IRB approval of 15 consecutive patients undergoing PE Nuss repair with INC, INB, and an enhanced recovery after surgery (ERAS) protocol was conducted. The primary outcome measure was hospital length of stay (LOS) in hours. Secondary variables included same day discharge, postoperative complications, emergency department (ED) visits, urgent care (UC) visits, opioid use, and return to the operating room (OR). LOS averaged 11.9 h amongst 15 patients. Ten patients (66.7%) went home on postoperative day (POD) 0, and the rest went home on POD 1. No patients stayed in the hospital due to pain. Reasons for failure to discharge included urinary retention, drowsiness, vomiting, and anxiety, but not pain. No patients were readmitted to the ED. One patient visited UC for constipation. One patient had bar migration requiring return to the OR for revision. Ten (66.7%) patients did not use opioids after discharge. Same day discharge is feasible and safe in PE patients undergoing Nuss procedure with INC and INB. INC with INB can adequately control pain without significant complications. Same day discharge can be safely considered for PE patients undergoing Nuss procedure with INC with INB. Prognosis study LEVEL-OF-EVIDENCE RATING: Level II.
33210165	sent_to_llm		1.0000	include	population_mismatch	primary_rct	0.7792	0.7792	0.0	0.0000	0.5000	normal	Journal Article	2020	Cryoablation is associated with shorter length of stay and reduced opioid use in pectus excavatum repair.	The use of intercostal nerve cryoablation (INC) is becoming increasingly common in patients undergoing pectus excavatum (PE) repair. This study sought to evaluate the use of INC compared to traditional use of thoracic epidural (TE). A retrospective review of 79 patients undergoing PE repair with either INC or TE from May 2009 to December 2019 was conducted. The operations were performed by four surgeons who worked together at four different hospitals and have the same standardized practice. The primary outcome measure was hospital length of stay (LOS). Secondary variables included surgical time, total operating room time, operating room time cost, total hospital cost, inpatient opioid use, long-term opioid use after discharge, and postoperative complications. LOS decreased to 2.5 days in the INC group compared to 5 days in the TE group (p < 0.0001). Surgical time was increased in the INC group, but there was no difference in total OR time. The INC group experienced significantly lower hospital costs. Total hospital opioid administration was significantly lower in INC group, and there was a significant decrease in long-term opioid use in the INC group. INC is a newer modality that decreases LOS, controls pain, and results in overall cost savings. We recommend that INC be included in the current practice for postoperative pain control in PE patients undergoing Nuss procedure.
33199059	sent_to_llm		1.0000	include	off_topic	primary_rct	0.8644	0.8644	0.0	0.0000	0.5000	normal	Journal Article	2020	Intercostal nerve cryoablation is associated with lower hospital cost during minimally invasive Nuss procedure for pectus excavatum.	Minimally invasive repair of pectus excavatum (Nuss procedure) is associated with significant pain, and efforts to control pain impact resource utilization. Bilateral thoracic intercostal nerve cryoablation has been proposed as a novel technique to improve post-operative pain control, though the impact on hospital cost is unknown. We conducted a retrospective study of patients undergoing a Nuss procedure from 2016 to 2019. Patients who received cryoablation were compared to those that received traditional pain control (patient-controlled analgesia or epidural). Outcome variables included postoperative opioid usage (milligram morphine equivalents, MME), length of stay (LOS), and hospital cost. Thirty-five of 73 patients studied (48%) received intercostal nerve cryoablation. LOS (1.0 vs 4.0 days, p < 0.01) and total hospital cost ($21,924 versus $23,694, p = 0.04) were decreased in the cryoablation cohort, despite longer operative time (152 vs 74 min, p < 0.01). Cryoablation was associated with decreased opioid usage (15.0 versus 148.6 MME, p < 0.01) during the 24 h following surgery and this persisted over the entire postoperative period, including discharge opioid prescription (112.5 vs 300.0 MME, p < 0.01). Bilateral intercostal nerve cryoablation is associated with decreased postoperative opioid usage and decreased resource utilization in pediatric patients undergoing a minimally invasive Nuss procedure for pectus excavatum. Retrospective comparative study, level III.
32929487	sent_to_llm		1.0000	include	off_topic	adjacent_meta_analysis	0.8582	0.8582	0.0	0.0000	0.5000	normal	Journal Article;Meta-Analysis;Systematic Review	2020	Intercostal nerve cryoablation versus thoracic epidural for postoperative analgesia following pectus excavatum repair: a systematic review and meta-analysis.	Minimally invasive pectus excavatum repair via the Nuss procedure is associated with significant postoperative pain that is considered as the dominant factor affecting the duration of hospitalization. Postoperative pain after the Nuss procedures is commonly controlled by thoracic epidural analgesia. Recently, intercostal nerve cryoablation has been proposed as an alternative method with long-acting pain control and shortened hospitalization. The subsequent objective was to systematically review the outcomes of intercostal nerve cryoablation in comparison to thoracic epidural after the Nuss procedure. Six scientific databases were searched. Data concerning the length of hospital stay, operative time and postoperative opioid usage were extracted. If possible, data were submitted to meta-analysis using the mean of differences, random-effects model with inverse variance method and I2 test for heterogeneity. Four observational and 1 randomized study were included, enrolling a total of 196 patients. Meta-analyses demonstrated a significantly shortened length of hospital stay [mean difference -2.91 days; 95% confidence interval (CI) -3.68 to -2.15; P < 0.001] and increased operative time (mean difference 40.91 min; 95% CI 14.42-67.40; P < 0.001) for cryoablation. Both analyses demonstrated significant heterogeneity (both I2 = 91%; P < 0.001). Qualitative analysis demonstrated the amount of postoperative opioid usage to be significantly lower for cryoablation in 3 out of 4 reporting studies. Intercostal nerve cryoablation during the Nuss procedure may be an attractive alternative to thoracic epidural analgesia, resulting in shortened hospitalization. However, given the low quality and heterogeneity of studies, more randomized controlled trials are needed.
32166917	sent_to_llm		1.0000	include	off_topic	off_topic	0.7327	0.7327	0.0	0.0000	0.5000	normal	Journal Article	2020	Thoracoscopic cryoanalgesia: A new strategy for postoperative pain control in minimally invasive pectus excavatum repair.	Recent publications report early discharge and low opioid requirements after minimally invasive pectus excavatum repair treated with bilateral intercostal nerve cryoablation. Our aim is to report our initial experience with this technique. Retrospective analysis of medical records of patients undergoing bilateral thoracoscopic cryoanalgesia during minimally invasive pectus excavatum repair within our institution from September 2018 to March 2019. A cryoprobe was applied at -70 ºC for 2 minutes each from the 3rd to the 7th intercostal nerves bilaterally under thoracoscopic control. Postoperative pain was assessed using a visual analogue scale (VAS). Twenty-one patients were included. Ninety percent were male, the mean age being 15.2 ± 4.29 years, and the mean weight being 53.6 ± 15.33 kg. The average Haller index was 5.1 ± 2.97, and the mean repair index was 37.6 ± 13.77%. The mean number of implants introduced was 2.55 ± 0.74. The mean duration of cryoanalgesia was 39.9 ± 21.1. No patients received epidural anesthesia. Mean postoperative stay was 1.64 ± 0.73 days. Seventy-one percent of the patients required 1 dose of opioids at the most for postoperative pain control. According to the VAS, the average pain score on postoperative days 1, 3, 7, and 21 was 2.55, 2.01, 0.5, and 0.06, respectively. Bilateral thoracoscopic cryoanalgesia during minimally invasive pectus excavatum repair leads to early discharge and good postoperative pain control in all cases. Cryoanalgesia has become our treatment of choice for pain control in the thoracoscopic repair of pectus excavatum.
31760443	sent_to_llm		1.0000	borderline	insufficient_info	primary_rct	0.8535	0.8535	0.0	0.0000	0.4000	normal	Journal Article;Multicenter Study	2019	The incidence of neuropathic pain after intercostal cryoablation during the Nuss procedure.	Intercostal nerve cryoblation during the Nuss procedure for pectus excavatum decreases pain, opiate requirement, and hospital length of stay (LOS) compared to thoracic epidural analgesia. However, long-term complications of cryoablation, including neuropathic pain development, are not well studied. We conducted a multi-institutional retrospective review of patients following intercostal nerve cryoablation during Nuss bar insertion (11/2015-7/2018). Patients completed the Leeds Assessment of Neuropathic Symptoms and Signs, a validated questionnaire for detecting neuropathic symptoms. Primary outcome was neuropathic pain development. Secondary outcomes included duration of chest numbness and LOS. T test was performed; p < 0.05 is significant. 43 patients underwent intercostal cryoablation during the Nuss procedure. Ages at repair ranged 11-47 years (median 16). Patients were grouped by age: ≤ 21 years (30 patients) or older (13 patients). Mean LOS was shorter for the younger group, 2.0 versus 3.9 days (p = 0.03). No patients in the younger group, and three in the older, experienced neuropathic pain. Mean time to numbness resolution was shorter for the younger group, 3.4 versus 10.8 months (p = 0.003). In pediatric patients, intercostal cryoablation provides effective analgesia following the Nuss procedure with minimal risk of post-operative neuropathic pain. Adult patients are at greater risk of experiencing neuropathic pain and prolonged numbness.
